{
  "schema_version": 1,
  "kind": "acoustic_clip",
  "apiary_id": "hive-observatory-pa",
  "hive_id": "hive2",
  "recorded_utc": "",
  "file": "20260917-130133-hive2-routine.wav",
  "audio": {
    "sample_rate_hz": 16000,
    "channels": 1,
    "bit_depth": 16,
    "duration_s": 10.0,
    "bytes": 320044
  },
  "microphone": "INMP441 I2S, inside the hive body",
  "site": {
    "region": "Pocono Plateau, Pennsylvania, USA",
    "climate": "",
    "hive_type": "Langstroth 10-frame"
  },
  "event": {
    "type": "routine",
    "risk": 0.0,
    "risk_scale": "0-100, this apiary's own swarm-risk model at capture time; comparable only as a trend within one apiary unless the model is stated",
    "confidence": "certain",
    "notes": "",
    "capture_trigger": "daily"
  },
  "conditions_at_capture": {
    "temperature": 73.2,
    "humidity": 94.4,
    "co2": 3597.0,
    "weight": 29.3,
    "audio_level": 41.4,
    "swarm_risk": 0.0
  },
  "note_on_comparability": "The WAV is the portable part: any band scheme or model can be recomputed from it. The figures under conditions_at_capture come from this apiary's own sensors and calibration, and should be treated as context rather than as measurements comparable across sites."
}